{"identifier": "", "motion_text": "S 3rd Reading:Passed 31-0-0-0-0", "motion_classification": [], "start_date": "2025-02-20T17:34:45+00:00", "result": "pass", "organization": "~{\"classification\": \"upper\"}", "legislative_session": "2025", "bill": "a375c22a-c5b0-11f0-917d-aeaef7ee5433", "bill_action": null, "bill_identifier": "HB0017", "votes": [{"option": "yes", "voter_name": "Anderson", "voter_id": "~{\"name\": \"Anderson\"}", "note": ""}, {"option": "yes", "voter_name": "Barlow", "voter_id": "~{\"name\": \"Barlow\"}", "note": ""}, {"option": "yes", "voter_name": "Boner", "voter_id": "~{\"name\": \"Boner\"}", "note": ""}, {"option": "yes", "voter_name": "Brennan", "voter_id": "~{\"name\": \"Brennan\"}", "note": ""}, {"option": "yes", "voter_name": "Case", "voter_id": "~{\"name\": \"Case\"}", "note": ""}, {"option": "yes", "voter_name": "Cooper", "voter_id": "~{\"name\": \"Cooper\"}", "note": ""}, {"option": "yes", "voter_name": "Crago", "voter_id": "~{\"name\": \"Crago\"}", "note": ""}, {"option": "yes", "voter_name": "Crum", "voter_id": "~{\"name\": \"Crum\"}", "note": ""}, {"option": "yes", "voter_name": "Dockstader", "voter_id": "~{\"name\": \"Dockstader\"}", "note": ""}, {"option": "yes", "voter_name": "Driskill", "voter_id": "~{\"name\": \"Driskill\"}", "note": ""}, {"option": "yes", "voter_name": "French", "voter_id": "~{\"name\": \"French\"}", "note": ""}, {"option": "yes", "voter_name": "Gierau", "voter_id": "~{\"name\": \"Gierau\"}", "note": ""}, {"option": "yes", "voter_name": "Hicks", "voter_id": "~{\"name\": \"Hicks\"}", "note": ""}, {"option": "yes", "voter_name": "Hutchings", "voter_id": "~{\"name\": \"Hutchings\"}", "note": ""}, {"option": "yes", "voter_name": "Ide", "voter_id": "~{\"name\": \"Ide\"}", "note": ""}, {"option": "yes", "voter_name": "Jones", "voter_id": "~{\"name\": \"Jones\"}", "note": ""}, {"option": "yes", "voter_name": "Kolb", "voter_id": "~{\"name\": \"Kolb\"}", "note": ""}, {"option": "yes", "voter_name": "Landen", "voter_id": "~{\"name\": \"Landen\"}", "note": ""}, {"option": "yes", "voter_name": "Laursen", "voter_id": "~{\"name\": \"Laursen\"}", "note": ""}, {"option": "yes", "voter_name": "McKeown", "voter_id": "~{\"name\": \"McKeown\"}", "note": ""}, {"option": "yes", "voter_name": "Nethercott", "voter_id": "~{\"name\": \"Nethercott\"}", "note": ""}, {"option": "yes", "voter_name": "Olsen", "voter_id": "~{\"name\": \"Olsen\"}", "note": ""}, {"option": "yes", "voter_name": "Pappas", "voter_id": "~{\"name\": \"Pappas\"}", "note": ""}, {"option": "yes", "voter_name": "Pearson", "voter_id": "~{\"name\": \"Pearson\"}", "note": ""}, {"option": "yes", "voter_name": "Rothfuss", "voter_id": "~{\"name\": \"Rothfuss\"}", "note": ""}, {"option": "yes", "voter_name": "Salazar", "voter_id": "~{\"name\": \"Salazar\"}", "note": ""}, {"option": "yes", "voter_name": "Schuler", "voter_id": "~{\"name\": \"Schuler\"}", "note": ""}, {"option": "yes", "voter_name": "Scott", "voter_id": "~{\"name\": \"Scott\"}", "note": ""}, {"option": "yes", "voter_name": "Smith", "voter_id": "~{\"name\": \"Smith\"}", "note": ""}, {"option": "yes", "voter_name": "Steinmetz", "voter_id": "~{\"name\": \"Steinmetz\"}", "note": ""}, {"option": "yes", "voter_name": "Biteman", "voter_id": "~{\"name\": \"Biteman\"}", "note": ""}], "counts": [{"option": "yes", "value": 31}, {"option": "no", "value": 0}, {"option": "absent", "value": 0}, {"option": "excused", "value": 0}, {"option": "other", "value": 0}], "sources": [{"url": "https://lso.wyoleg.gov/Legislation/2025/HB0017", "note": ""}], "extras": {}, "_id": "a377babc-c5b0-11f0-917d-aeaef7ee5433"}